A1: ID# (last 7) | B1: Participation | C1: Mid-term_Score | D1: Final_Score | E1: Final_Grade | F1: Letter Grade
A2: 639372 | B2: 7.5 | C2: 89 | D2: 82 | E2: =B2+0.4*C2+0.5*D2 -> 84.1 | F2: B
A3: 465177 | B3: 0 | E3: =B3+0.4*C3+0.5*D3 -> 0
A4: 743305 | B4: 0 | E4: =B4+0.4*C4+0.5*D4 -> 0
A5: 779509 | B5: 0 | E5: =B5+0.4*C5+0.5*D5 -> 0
A6: 197806 | B6: 8.3333333333333339 | C6: 86 | D6: 86 | E6: =B6+0.4*C6+0.5*D6 -> 85.733333333333334 | F6: B
A7: 722242 | B7: 7.916666666666667 | C7: 86 | D7: 88 | E7: =B7+0.4*C7+0.5*D7 -> 86.316666666666663 | F7: B
A8: 652765 | B8: 8.0833333333333339 | C8: 62 | D8: 56 | E8: =B8+0.4*C8+0.5*D8 -> 60.883333333333333 | F8: C
A9: 566041 | B9: 3.3333333333333335 | C9: 64 | D9: 58 | E9: =B9+0.4*C9+0.5*D9 -> 57.933333333333337 | F9: C
A10: 651594 | B10: 4.166666666666667 | C10: 76 | D10: 70 | E10: =B10+0.4*C10+0.5*D10 -> 69.566666666666663 | F10: B
A11: 930646 | B11: 1 | C11: 65 | D11: 44 | E11: =B11+0.4*C11+0.5*D11 -> 49 | F11: C
A12: 56260 | B12: 1.6666666666666667 | C12: 64 | E12: =B12+0.4*C12+0.5*D12 -> 27.266666666666669 | F12: F
A13: 204505 | B13: 0.83333333333333337 | C13: 54 | D13: 34 | E13: =B13+0.4*C13+0.5*D13 -> 39.433333333333337 | F13: D
A14: 819766 | B14: 6 | C14: =54+6 -> 60 | D14: 80 | E14: =B14+0.4*C14+0.5*D14 -> 70 | F14: B
A15: 928529 | B15: 7.5 | C15: =83+5 -> 88 | D15: 96 | E15: =B15+0.4*C15+0.5*D15 -> 90.7 | F15: A
A16: 937079 | B16: 10 | C16: 100 | D16: 96 | E16: =B16+0.4*C16+0.5*D16 -> 98 | F16: A
A17: 811718 | B17: 10 | C17: 100 | D17: 96 | E17: =B17+0.4*C17+0.5*D17 -> 98 | F17: A
A18: 673353 | B18: 0 | E18: =B18+0.4*C18+0.5*D18 -> 0
A19: 948997 | B19: 5.166666666666667 | C19: 78 | D19: 74 | E19: =B19+0.4*C19+0.5*D19 -> 73.366666666666674 | F19: B
A20: 221122 | B20: 0 | E20: =B20+0.4*C20+0.5*D20 -> 0
A21: 953762 | B21: 7.666666666666667 | C21: 66 | D21: 86 | E21: =B21+0.4*C21+0.5*D21 -> 77.066666666666663 | F21: B
A22: 38256 | B22: 0 | E22: =B22+0.4*C22+0.5*D22 -> 0
A23: 671625 | B23: 5.416666666666667 | C23: 74 | D23: 34 | E23: =B23+0.4*C23+0.5*D23 -> 52.016666666666666 | F23: C
A24: 185554 | B24: 9.1666666666666661 | C24: 100 | D24: 86 | E24: =B24+0.4*C24+0.5*D24 -> 92.166666666666657 | F24: A
A25: 673512 | B25: 8.3333333333333339 | C25: 77 | D25: 30 | E25: =B25+0.4*C25+0.5*D25 -> 54.133333333333333 | F25: C
A26: 924962 | B26: 1.6666666666666667 | C26: 66 | E26: =B26+0.4*C26+0.5*D26 -> 28.06666666666667 | F26: F
A27: 951857 | B27: 5.166666666666667 | C27: 64 | D27: 62 | E27: =B27+0.4*C27+0.5*D27 -> 61.766666666666666 | F27: C
A28: 694796 | B28: 5.833333333333333 | C28: 80 | D28: 84 | E28: =B28+0.4*C28+0.5*D28 -> 79.833333333333343 | F28: B
A29: 659382 | B29: 3.3333333333333335 | C29: 69 | D29: 76 | E29: =B29+0.4*C29+0.5*D29 -> 68.933333333333337 | F29: C
A30: 778556 | B30: 0 | C30: 70 | D30: 68 | E30: =B30+0.4*C30+0.5*D30 -> 62 | F30: C
A31: 453035 | B31: 0 | E31: =B31+0.4*C31+0.5*D31 -> 0
A32: 757847 | B32: 1.6666666666666667 | C32: 56 | D32: 34 | E32: =B32+0.4*C32+0.5*D32 -> 41.06666666666667 | F32: D
A33: 471124 | B33: 6.666666666666667 | C33: 72 | D33: 72 | E33: =B33+0.4*C33+0.5*D33 -> 71.466666666666669 | F33: B
A34: 806550 | B34: 10 | C34: 100 | D34: 94 | E34: =B34+0.4*C34+0.5*D34 -> 97 | F34: A
A35: 460 | B35: 7.666666666666667 | C35: 79 | D35: 74 | E35: =B35+0.4*C35+0.5*D35 -> 76.266666666666666 | F35: B
A36: 731212 | B36: 3.6666666666666665 | C36: 90 | D36: 80 | E36: =B36+0.4*C36+0.5*D36 -> 79.666666666666657 | F36: B
A37: 652648 | B37: 9.5833333333333339 | C37: 80 | D37: 86 | E37: =B37+0.4*C37+0.5*D37 -> 84.583333333333343 | F37: B
B38: 5 | C38: 83 | D38: 66 | E38: =B38+0.4*C38+0.5*D38 -> 71.2 | F38: B
A39: 15160 | B39: 5.833333333333333 | C39: 92 | D39: 74 | E39: =B39+0.4*C39+0.5*D39 -> 79.63333333333334 | F39: B
A40: 720088 | B40: 5.833333333333333 | C40: 90 | D40: 84 | E40: =B40+0.4*C40+0.5*D40 -> 83.833333333333343 | F40: B