A1: Student ID (last 7 digits) | B1: Partcipation | C1: Mid_Score | D1: Fin_Quiz | E1: Fin_Essa1 | F1: Fin_Total | G1: Paper | H1: Fin_Grade | I1: Letter Grade
A2: 357806 | B2: 10 | C2: 94 | D2: 52 | E2: 29 | F2: =D2+E2 -> 81 | H2: =B2+0.35*C2+0.55*F2 -> 87.45 | I2: A
A3: 524950 | B3: 9.5 | C3: 62 | D3: 26 | E3: 11 | F3: =D3+E3 -> 37 | H3: =B3+0.35*C3+0.55*F3 -> 51.55 | I3: C
A4: 898065 | B4: 8 | C4: 80 | D4: 52 | E4: 24 | F4: =D4+E4 -> 76 | H4: =B4+0.35*C4+0.55*F4 -> 77.8 | I4: B
A5: 357486 | B5: 8.5 | C5: 90 | D5: 42 | E5: 21 | F5: =D5+E5 -> 63 | H5: =B5+0.35*C5+0.55*F5 -> 74.65 | I5: B
A6: 50825 | B6: 10 | C6: 67 | D6: 44 | E6: 17 | F6: =D6+E6 -> 61 | H6: =B6+0.35*C6+0.55*F6 -> 67 | I6: B
A7: 873957 | B7: 8 | C7: 82 | D7: 34 | E7: 21 | F7: =D7+E7 -> 55 | H7: =B7+0.35*C7+0.55*F7 -> 66.95 | I7: B
A8: 222412 | B8: 4 | C8: 63 | D8: 42 | E8: 9 | F8: =D8+E8 -> 51 | H8: =B8+0.35*C8+0.55*F8 -> 54.1 | I8: C
A9: 958459 | B9: 9 | C9: 98 | D9: 46 | E9: 35 | F9: =D9+E9 -> 81 | H9: =B9+0.35*C9+0.55*F9 -> 87.85 | I9: A
A10: 638199 | B10: 10 | C10: 94 | D10: 34 | E10: 25 | F10: =D10+E10 -> 59 | H10: =B10+0.35*C10+0.55*F10 -> 75.35 | I10: B
A11: 696434 | B11: 5 | C11: 98 | D11: 42 | E11: 23 | F11: =D11+E11 -> 65 | G11: 70 | H11: =B11+0.35*C11+0.35*F11+0.2*G11 -> 76.05 | I11: B
A12: 908261 | B12: 5 | C12: 89 | D12: 38 | E12: 33 | F12: =D12+E12 -> 71 | H12: =B12+0.35*C12+0.55*F12 -> 75.2 | I12: B
A13: 909801
A14: 882099
A15: 182574 | B15: 3 | C15: 65 | D15: 42 | E15: 16 | F15: =D15+E15 -> 58 | G15: 70 | H15: =B15+0.35*C15+0.55*F15 -> 60.05 | I15: C
A16: 93785 | B16: 7 | C16: 89 | D16: 36 | E16: 15 | F16: =D16+E16 -> 51 | H16: =B16+0.35*C16+0.55*F16 -> 66.2 | I16: B
A17: 696546
A18: 510030 | B18: 8 | C18: 80 | D18: 40 | E18: 16 | F18: =D18+E18 -> 56 | H18: =B18+0.35*C18+0.55*F18 -> 66.8 | I18: B
A19: 88856 | B19: 5.5 | C19: 68 | D19: 38 | E19: 20 | F19: =D19+E19 -> 58 | G19: 77 | H19: =B19+0.35*C19+0.35*F19+0.2*G19 -> 65 | I19: B
A20: 954721 | B20: 4.5 | C20: 60 | D20: 36 | E20: 15 | F20: =D20+E20 -> 51 | H20: =B20+0.35*C20+0.55*F20 -> 53.55 | I20: C
A21: 718022 | B21: 9 | C21: 94 | D21: 54 | E21: 37 | F21: =D21+E21 -> 91 | H21: =B21+0.35*C21+0.55*F21 -> 91.95 | I21: A
A22: 792216
A23: 455588 | B23: 5 | C23: 91 | D23: 42 | E23: 27 | F23: =D23+E23 -> 69 | H23: =B23+0.35*C23+0.55*F23 -> 74.8 | I23: B
A24: 659649 | B24: 3 | C24: 74 | H24: =B24+0.35*C24+0.55*F24 -> 28.9 | I24: F
A25: 946267 | B25: 6 | C25: 71 | D25: 46 | E25: 25 | F25: =D25+E25 -> 71 | H25: =B25+0.35*C25+0.55*F25 -> 69.9 | I25: B
A26: 973007 | B26: 8 | C26: 92 | D26: 54 | E26: 21 | F26: =D26+E26 -> 75 | H26: =B26+0.35*C26+0.55*F26 -> 81.45 | I26: A
A27: 984820 | B27: 10 | C27: 92 | D27: 44 | E27: 34 | F27: =D27+E27 -> 78 | H27: =B27+0.35*C27+0.55*F27 -> 85.1 | I27: A
A28: 43083 | B28: 9.5 | C28: 86 | D28: 30 | E28: 32 | F28: =D28+E28 -> 62 | H28: =B28+0.35*C28+0.55*F28 -> 73.7 | I28: B
A29: 595621 | B29: 9 | C29: 77 | D29: 28 | E29: 7 | F29: =D29+E29 -> 35 | H29: =B29+0.35*C29+0.55*F29 -> 55.2 | I29: C